"motivo_de_nao_ir_ao_medico_regularmente_por_causa_da_depressao",674,"Motivo de não ir ao médico regularmente por causa da depressão"
"motivo_de_nao_procurar_a_policia_ou_guarda_municipal",1359,"Motivo de não procurar a polícia ou guarda municipal"
"motivo_de_nao_ter_usado_camisinha",1199,"Motivo de não ter usado camisinha"
"motivo_de_nao_terem_telefone_movel_celular_para_uso_pessoal",958,"Motivo de não terem telefone móvel celular para uso pessoal"
"motivo_de_nao_terem_utilizado_a_internet",425,"Motivo de não terem utilizado a internet"
"motivo_de_nenhum_morador_ter_viajado",899,"Motivo de nenhum morador ter viajado"
"motivo_de_ter_tido_parto_cesareo",722,"Motivo de ter tido parto cesáreo"
"motivo_do_nao_atendimento",12285,"Motivo do não atendimento"
"motivo_do_nao_consumo",12195,"Motivo do não consumo"
"motivo_principal_da_procura_de_atendimento_de_saude",12272,"Motivo principal da procura de atendimento de saúde"
"motivo_s_do_extravasamento",996,"Motivo(s) do extravasamento"
"motivo_causa_da_humilhacao_sofrida_pelo_escolar",752,"Motivo/causa da humilhação sofrida pelo escolar"
"motivos_da_interrupcao_racionamento",992,"Motivos da interrupção / racionamento"
"movimento_da_apicultura_no_ano",12735,"Movimento da apicultura no ano"
"movimento_da_aquicultura_no_ano",12736,"Movimento da aquicultura no ano"
"movimento_da_ranicultura_no_ano",12740,"Movimento da ranicultura no ano"
"movimento_de_asininos_no_ano",12721,"Movimento de asininos no ano"
"movimento_de_aves_no_ano",12654,"Movimento de aves no ano"
"movimento_de_bubalinos_no_ano",12727,"Movimento de bubalinos no ano"
"movimento_de_caprinos_no_ano",12729,"Movimento de caprinos no ano"
"movimento_de_coelhos_no_ano",12731,"Movimento de coelhos no ano"
"movimento_de_equinos_no_ano",12720,"Movimento de equinos no ano"
"movimento_de_muares_no_ano",12725,"Movimento de muares no ano"
"movimento_de_outras_aves_no_ano",12657,"Movimento de outras aves no ano"
"movimento_de_ovinos_no_ano",12733,"Movimento de ovinos no ano"
"movimento_de_ovos_de_galinhas_no_ano_nos_estabelecimentos_com_mais_de_2_000_cabecas_em_31_12",12734,"Movimento de ovos de galinhas no ano nos estabelecimentos com mais de 2.000 cabeças em 31/12"
"movimento_do_rebanho_suino_no_ano",12651,"Movimento do rebanho suíno no ano"
"movimento_pecuario_de_bovinos_no_ano",12626,"Movimento pecuário de bovinos no ano"
"movimento_pecuario_de_bovinos_nos_estabelecimentos_agropecuarios_com_mais_de_50_cabecas_em_31_12",12644,"Movimento pecuário de bovinos nos estabelecimentos agropecuários com mais de 50 cabeças em 31/12"
"movimento_pecuario_de_bovinos_vendidos_nos_estabelecimentos_agropecuarios_com_mais_de_50_cabecas_em_31_12",12645,"Movimento pecuário de bovinos vendidos nos estabelecimentos agropecuários com mais de 50 cabeças em 31/12"
"mudancas_estrategicas_e_organizacionais_implementadas",793,"Mudanças estratégicas e organizacionais implementadas"
"mulheres_de_10_anos_e_mais_de_idade",12238,"Mulheres de 10 anos e mais de idade"
"mulheres_de_10_anos_ou_mais_de_idade_que_viviam_ou_ja_viveram_em_companhia_de_conjuge_ou_companheiro_que_tiveram_filhos",12303,"Mulheres de 10 anos ou mais de idade que viviam ou já viveram em companhia de cônjuge ou companheiro que tiveram filhos"
"na_vida_do_escolar_com_quantas_pessoas_ele_ja_teve_relacao_sexual",155,"Na vida do escolar, com quantas pessoas ele já teve relação sexual"
"na_vida_do_escolar_quantas_vezes_ele_bebeu_tanto_que_ficou_realmente_bebado",131,"Na vida do escolar, quantas vezes ele bebeu tanto que ficou realmente bêbado"
"nacionalidade",302,"Nacionalidade"
"nacionalidade_da_mulher",250,"Nacionalidade da mulher"
"nacionalidade_do_homem",249,"Nacionalidade do homem"
"nacionalidade_do_primeiro_conjuge",676,"Nacionalidade do primeiro cônjuge"
"nacionalidade_do_segundo_conjuge",677,"Nacionalidade do segundo cônjuge"
"nacionalidade_pais_de_origem",1727,"Nacionalidade/país de origem"
"naturalidade_em_relacao_a_unidade_da_federacao",388,"Naturalidade em relação à unidade da federação"
"naturalidade_em_relacao_ao_municipio",184,"Naturalidade em relação ao município"
"naturalidade_em_relacao_ao_municipio_e_a_unidade_da_federacao",12017,"Naturalidade em relação ao município e à unidade da federação"
"naturalidade_ou_nacionalidade_da_pessoa_que_dirige_o_estabelecimento",12557,"Naturalidade ou nacionalidade da pessoa que dirige o estabelecimento"
"natureza_da_acao",262,"Natureza da ação"
"natureza_da_acao_nao_consensual",264,"Natureza da ação não consensual"
"natureza_da_uniao_conjugal",1598,"Natureza da união conjugal"
"natureza_do_obito",1836,"Natureza do óbito"
"natureza_do_processo",279,"Natureza do processo"
"natureza_dos_servicos",2646,"Natureza dos serviços"
"natureza_juridica",2703,"Natureza jurídica"
"natureza_juridica_das_entidades_prestadoras_de_servico",11973,"Natureza jurídica das entidades prestadoras de serviço"
"necessidade_de_ampliacao_do_numero_de_leitos_para_atender_a_demanda_por_internacao_no_municipio_em_virtude_da_covid_19",1256,"Necessidade de ampliação do número de leitos para atender à demanda por internação no município em virtude da COVID-19"
"necessidade_de_referenciar_o_s_paciente_s_para_outro_municipio",1668,"Necessidade de referenciar o(s) paciente(s) para outro município"
"niveis_50_e_100",12227,"Níveis 50 e 100"
"nivel_100",75,"Nível - 100"
"nivel_concluido",12401,"Nível concluído"
"nivel_de_confianca_nas_instituicoes",1400,"Nível de confiança nas instituições"
"nivel_de_confianca_nas_pessoas",1394,"Nível de confiança nas pessoas"
"nivel_de_ensino_ou_curso_que_frequentavam",11798,"Nível de ensino ou curso que frequentavam"
"nivel_de_ensino_duracao_do_ensino_fundamental_e_serie_que_frequentavam",12760,"Nível de ensino, duração do ensino fundamental e série que frequentavam"
"nivel_de_governo",11227,"Nível de governo"
"nivel_de_instrucao",1568,"Nível de instrução"
"nivel_de_instrucao_da_mae",375,"Nível de instrução da mãe"
"nivel_de_instrucao_da_pessoa_que_dirige_o_estabelecimento",12552,"Nível de instrução da pessoa que dirige o estabelecimento"
"nivel_de_instrucao_da_pessoa_responsavel_pela_familia",512,"Nível de instrução da pessoa responsável pela família"
"nivel_de_instrucao_da_pessoa_responsavel_pelos_cuidados_de_saude_da_crianca",1437,"Nível de instrução da pessoa responsável pelos cuidados de saúde da criança"
"nivel_de_instrucao_do_chefe_da_familia",283,"Nível de instrução do chefe da família"
"nivel_de_instrucao_do_pai",557,"Nível de instrução do pai"
"nivel_de_instrucao_do_prefeito",12451,"Nível de instrução do prefeito"
"nivel_de_instrucao_do_produtor",12772,"Nível de instrução do produtor"
"nivel_de_instrucao_do_responsavel_pelo_domicilio",1829,"Nível de instrução do responsável pelo domicílio"
"nivel_de_instrucao_do_titular_do_orgao_gestor",1060,"Nível de instrução do titular do órgão gestor"
"nivel_de_instrucao_mais_elevado_concluido",518,"Nível de instrução mais elevado concluído"
"nivel_do_curso",885,"Nível do curso"
"nivel_educacional_concluido",12400,"Nível educacional concluído"
"nivel_na_instituicao_publica",1776,"Nível na instituição pública"
"nos_ultimos_12_meses_o_escolar_teve_relacoes_sexuais",156,"Nos últimos 12 meses, o escolar teve relações sexuais"
"nos_ultimos_30_dias_em_quantos_dias_o_escolar_faltou_as_aulas_sem_permissao_dos_seus_pais_ou_responsaveis",101,"Nos últimos 30 dias, em quantos dias o escolar faltou às aulas sem permissão dos seus pais ou responsáveis"
"nos_ultimos_30_dias_em_quantos_o_escolar_deixou_de_ir_a_escola_por_nao_se_sentir_seguro_na_escola",169,"Nos últimos 30 dias, em quantos o escolar deixou de ir à escola por não se sentir seguro na escola"
"nos_ultimos_30_dias_em_quantos_o_escolar_deixou_de_ir_a_escola_por_nao_se_sentir_seguro_no_caminho_de_ida_ou_de_volta",168,"Nos últimos 30 dias, em quantos o escolar deixou de ir à escola por não se sentir seguro no caminho de ida ou de volta"
"nos_ultimos_30_dias_nos_dias_em_que_o_escolar_tomou_alguma_bebida_alcolica_quantos_copos_ou_doses_tomou_po_dia",130,"Nos últimos 30 dias, nos dias em que o escolar tomou alguma bebida alcólica, quantos copos ou doses tomou po dia"
"nos_ultimos_30_dias_o_escolar_esteve_envolvido_em_alguma_briga_em_que_alguem_foi_fisicamente_agredido",171,"Nos últimos 30 dias, o escolar esteve envolvido em alguma briga em que alguém foi fisicamente agredido"
"nos_ultimos_30_dias_quantas_vezes_o_escolar_foi_agredido_fisicamente_por_um_adulto_da_familia_dele",170,"Nos últimos 30 dias, quantas vezes o escolar foi agredido fisicamente por um adulto da família dele"
"nos_ultimos_30_dias_quantas_vezes_usou_drogas_tais_como_maconha_cocaina_crack_cola_lolo_lanca_perfume_ecstasy_ou_outra",149,"Nos últimos 30 dias,quantas vezes usou drogas tais como: maconha, cocaína, crack, cola, loló, lança perfume, ecstasy ou outra"
"nos_ultimos_7_dias_em_quantos_outras_pessoas_fumaram_na_casa_do_escolar",120,"Nos últimos 7 dias, em quantos outras pessoas fumaram na casa do escolar"
"nota_atribuida_ao_servico_de_saude_pela_pessoa_responsavel_pelos_cuidados_de_saude_da_crianca",1468,"Nota atribuída ao serviço de saúde pela pessoa responsável pelos cuidados de saúde da criança"
"numero_de_bacias",12131,"Número de bacias"
"numero_de_banheiros",66,"Número de banheiros"
"numero_de_canais_de_tv_aberta_captados_no_municipio",1545,"Número de canais de TV aberta captados no município"
"numero_de_cartoes_de_credito",199,"Número de cartões de crédito"
"numero_de_cheques_especiais",200,"Número de cheques especiais"
"numero_de_comodos",65,"Número de cômodos"
"numero_de_comodos_servindo_de_dormitorio",64,"Número de cômodos servindo de dormitório"
"numero_de_componentes_da_familia",12088,"Número de componentes da família"
"numero_de_componentes_da_familia_e_numero_dos_que_tem_rendimentos",12250,"Número de componentes da família e número dos que têm rendimentos"
"numero_de_consultas_de_pre_natal",719,"Número de consultas de pré-natal"
"numero_de_dias_em_que_bebeu_leite_exceto_de_soja_nos_ultimos_7_dias",87,"Número de dias em que bebeu leite (exceto de soja) nos últimos 7 dias"
"numero_de_dias_em_que_comeu_batata_frita_nos_ultimos_7_dias",88,"Número de dias em que comeu batata frita nos últimos 7 dias"
"numero_de_dias_em_que_comeu_feijao_nos_ultimos_7_dias",77,"Número de dias em que comeu feijão nos últimos 7 dias"
"numero_de_dias_em_que_comeu_guloseimas_nos_ultimos_7_dias",92,"Número de dias em que comeu guloseimas nos últimos 7 dias"
"numero_de_dias_em_que_comeu_hamburger_salsicha_mortadela_salame_presunto_nuggets_ou_linguica_nos_ultimos_7_dias",89,"Número de dias em que comeu hamburger, salsicha, mortadela, salame, presunto, nuggets ou linguiça nos últimos 7 dias"
"numero_de_dias_em_que_comeu_legumes_ou_verduras_cozidos_na_comida_ou_sopa_exceto_batata_e_aipim_nos_ultimos_7_dias",83,"Número de dias em que comeu legumes ou verduras cozidos na comida ou sopa (exceto batata e aipim) nos últimos 7 dias"
"numero_de_dias_em_que_comeu_salada_crua_nos_ultimos_7_dias",78,"Número de dias em que comeu salada crua nos últimos 7 dias"
"numero_de_dias_em_que_comeu_salgados_fritos_nos_ultimos_7_dias",91,"Número de dias em que comeu salgados fritos nos últimos 7 dias"
"numero_de_dias_em_que_fumou_cigarros_nos_ultimos_30_dias",118,"Número de dias em que fumou cigarros nos últimos 30 dias"
"numero_de_domicilios_em_que_trabalhavam",785,"Número de domicílios em que trabalhavam"
"numero_de_dormitorios",74,"Número de dormitórios"
"numero_de_doses_de_vacina_ja_tomadas_quando_teve_a_doenca_pela_primeira_vez",1811,"Número de doses de vacina já tomadas quando teve a doença pela primeira vez"
"numero_de_empregados_no_trabalho_principal",12392,"Número de empregados no trabalho principal"
"numero_de_empregados_permanentes",142,"Número de empregados permanentes"
"numero_de_estabelecimentos_de_saude",1588,"Número de estabelecimentos de saúde"
"numero_de_familias",197,"Número de famílias"
"numero_de_filhos",271,"Número de filhos"
"numero_de_filhos_menores_de_10_anos_ou_nao_economicamente_ativos",515,"Número de filhos menores de 10 anos ou não economicamente ativos"
"numero_de_filhos_menores_de_idade",737,"Número de filhos menores de idade"
"numero_de_filhos_nao_economicamente_ativos",12254,"Número de filhos não economicamente ativos"
"numero_de_filhos_tidos_nascidos_vivos",12291,"Número de filhos tidos nascidos vivos"
"numero_de_internacoes",12282,"Número de internações"
"numero_de_moradores",68,"Número de moradores"
"numero_de_nascidos_por_parto",238,"Número de nascidos por parto"
"numero_de_parceiros_sexuais_do_escolar",753,"Número de parceiros sexuais do escolar"
"numero_de_pavimentos_predominante_nas_construcoes",589,"Número de pavimentos predominante nas construções"
"numero_de_pessoas",140,"Número de pessoas"
"numero_de_pessoas_ocupadas_no_trabalho_principal",12048,"Número de pessoas ocupadas no trabalho principal"
"numero_de_pessoas_1",206,"Número de pessoas."
"numero_de_televisoes",684,"Número de televisões"
"numero_de_televisoes_no_domicilio",938,"Número de televisões no domicílio"
"numero_de_trabalhos",12031,"Número de trabalhos"
"numero_de_trabalhos_na_semana_de_referencia",12389,"Número de trabalhos na semana de referência"
"numero_de_vezes_que_considera_que_teve_covid_19",1807,"Número de vezes que considera que teve COVID-19"
"numero_de_vezes_que_teve_covid_19",1806,"Número de vezes que teve COVID-19"
"numero_de_vezes_que_teve_ou_considera_que_teve_covid_19",1834,"Número de vezes que teve ou considera que teve COVID-19"
"numero_de_viagens_realizadas_pelos_moradores",889,"Número de viagens realizadas pelos moradores"
"numero_filhos",272,"Número filhos"
"o_escolar_ja_recebeu_na_escola_orientacao_sobre_aids_ou_outras_doencas_sexualmente_transmissiveis_dsts",165,"O escolar já recebeu na escola orientação sobre Aids ou outras doenças sexualmente transmissíveis (DSTs)"
"o_escolar_ja_recebeu_na_escola_orientacao_sobre_como_conseguir_preservativo_gratuitamente",167,"O escolar já recebeu na escola orientação sobre como conseguir preservativo gratuitamente"
"o_escolar_ja_recebeu_na_escola_orientacao_sobre_prevencao_de_gravidez",159,"O escolar já recebeu na escola orientação sobre prevenção de gravidez"
"o_escolar_ja_teve_relacao_sexual_alguma_vez",152,"O escolar já teve relação sexual alguma vez"
"objeto_de_cooperacao",728,"Objeto de cooperação"
"ocorrencia_da_pratica_de_bullying_pelo_escolar",784,"Ocorrência da prática de bullying pelo escolar"
"ocorrencia_de_alagamento_nos_ultimos_4_anos",1195,"Ocorrência de alagamento nos últimos 4 anos"
"ocorrencia_de_algum_impacto_ambiental_e_ou_processo_acao_que_resulte_em_impacto_no_ambiente",1182,"Ocorrência de algum impacto ambiental e/ou processo/ação que resulte em impacto no ambiente"
"ocorrencia_de_casos_confirmados_clinicamente_ou_laboratorialmente_de_covid_19_no_municipio",1254,"Ocorrência de casos confirmados clinicamente ou laboratorialmente de COVID-19 no município"
"ocorrencia_de_internacao_de_pessoas_em_virtude_da_covid_19",1311,"Ocorrência de internação de pessoas em virtude da COVID-19"
"ocorrencia_de_internacoes_acima_da_capacidade_de_leitos_e_de_uti_publicos_ou_privados_conveniados_ao_sus",1349,"Ocorrência de internações acima da capacidade de leitos e de UTI públicos ou privados conveniados ao SUS"
"ocorrencia_de_obito_dentre_as_pessoas_que_contrairam_a_covid_19",1258,"Ocorrência de óbito dentre as pessoas que contraíram a COVID-19"
"ocorrencia_de_obitos_no_ano_do_desastre_natural_de_maior_impacto_para_o_municipio",1213,"Ocorrência de óbitos no ano do desastre natural de maior impacto para o município"
"ocorrencia_de_pernoite",891,"Ocorrência de pernoite"
"ocorrencia_de_processo_erosivo_nos_ultimos_4_anos",1196,"Ocorrência de processo erosivo nos últimos 4 anos"
"ocorrencia_de_seca_nos_ultimos_4_anos",1346,"Ocorrência de seca nos últimos 4 anos"
"ocorrencia_de_viagem",898,"Ocorrência de viagem"
"ocorrencia_e_duracao_de_interrupcao_da_fluoretacao_no_ano_de_referencia",987,"Ocorrência e duração de interrupção da fluoretação no ano de referência"
"ocorrencias_no_ano_da_seca_de_maior_impacto",1188,"Ocorrências no ano da seca de maior impacto"
"oferta_gratuita_de_merenda_escolar_ou_outra_refeicao_pela_creche_ou_escola",12376,"Oferta gratuita de merenda escolar ou outra refeição pela creche ou escola"
"organismos_que_integram_o_sme",1564,"Organismos que integram o SME"
"orientacao_tecnica",12548,"Orientação técnica"
"origem_da_agua_recebida",944,"Origem da água recebida"
"origem_da_carga",12122,"Origem da carga"
"origem_da_orientacao_tecnica_recebida",12567,"Origem da orientação técnica recebida"
"origem_da_receita",12203,"Origem da receita"
"origem_do_leite_recebido",17,"Origem do leite recebido"
"origem_do_movimento_migratorio",289,"Origem do movimento migratório"
"origem_do_recebimento",214,"Origem do recebimento"
"origem_do_recebimento_do_chefe_da_familia",284,"Origem do recebimento do chefe da família"
"origem_do_rendimento",541,"Origem do rendimento"
"origem_dos_rendimentos",4908,"Origem dos rendimentos"
"outras_atividades_de_servicos",12362,"Outras atividades de serviços"
"outros_animais_de_criacao",23,"Outros animais de criação"
"padrao_de_acabamento",41,"Padrão de acabamento"
"pagamento_pelo_atendimento",12277,"Pagamento pelo atendimento"
"pais_de_nascimento",1709,"Pais de nascimento"
"pais_de_residencia_anterior",507,"País de residência anterior"
"pais_de_residencia_em_31_07_2005",509,"País de residência em 31/07/2005"
"paises_de_destino",26,"Países de destino"
"parte_do_sistema_de_esgotamento_sanitario_onde_estao_sendo_feitas_ampliacoes_ou_melhorias",12014,"Parte do sistema de esgotamento sanitário onde estão sendo feitas ampliações ou melhorias"
"parte_do_sistema_onde_estao_sendo_feitas_as_ampliacoes_ou_melhorias",11996,"Parte do sistema onde estâo sendo feitas as ampliações ou melhorias"
"participacao_da_sociedade_civil_na_elaboracao_do_plano",1530,"Participação da sociedade civil na elaboração do plano"
"participacao_em_algum_colegiado_de_gestao_regional_da_saude",1581,"Participação em algum Colegiado de Gestão Regional da Saúde"
"participacao_na_receita_liquida_de_revenda",12353,"Participação na receita líquida de revenda"
"partido_politico_do_prefeito",12447,"Partido político do prefeito"
"percentis_das_medidas_antropometricas_de_criancas_e_adolecentes_com_ata_19_anos_de_idade",367,"Percentis das medidas antropométricas de crianças e adolecentes com atá 19 anos de idade"
"percentual_da_tarifa_cobrada",12013,"Percentual da tarifa cobrada"
"percentual_de_domicilios_com_lixo_coletado",12182,"Percentual de domicílios com lixo coletado"
"percentual_de_execucao_do_orcamento_previsto_para_a_cultura_no_ano_anterior_ao_da_pesquisa",1549,"Percentual de execução do orçamento previsto para a cultura no ano anterior ao da pesquisa"
"percentual_de_perdas_faturadas",11987,"Percentual de perdas faturadas"
"percentual_de_ruas_pavimentadas",12142,"Percentual de ruas pavimentadas"
"percentual_de_ruas_pavimentadas_com_drenagem_subterraneo",12144,"Percentual de ruas pavimentadas com drenagem subterrâneo"
"percentual_de_ruas_pavimentadas_com_drenagem_superficial",12145,"Percentual de ruas pavimentadas com drenagem superficial"
"percentual_de_ruas_pavimentadas_exclusivamente_com_drenagem_superficial",28,"Percentual de ruas pavimentadas exclusivamente com drenagem superficial"
"percentual_de_ruas_pavimentadas_sem_drenagem",12143,"Percentual de ruas pavimentadas sem drenagem"
"percentual_de_utilizacao_de_recurso_da_lei_aldir_blanc",1552,"Percentual de utilização de recurso da Lei Aldir Blanc"
"percentual_do_orcamento_destinado_aos_servicos",12127,"Percentual do orçamento destinado aos serviços"
"percentual_do_orcamento_gasto_com_pessoal_ocupado_nos_servicos",12183,"Percentual do orçamento gasto com pessoal ocupado nos serviços"
"percepcao_do_risco_de_vitimizacao",1402,"Percepção do risco de vitimização"
"periodicidade_do_racionamento_de_agua",11980,"Periodicidade do racionamento de água"
"periodo_de_ratificacao_dos_atos_multilaterais",710,"Período de ratificação dos Atos Multilaterais"
"periodo_de_referencia",12051,"Período de referência"
"periodo_do_dia",1413,"Período do dia"
"permanencia_de_algum_sintoma_apos_30_dias_do_inicio_da_doenca_ou_surgimento_de_sintoma_apos_esse_periodo",1814,"Permanência de algum sintoma após 30 dias do início da doença ou surgimento de sintoma após esse período"
"pertencimento_a_terra_de_indigena_ti_versus_agricultura_familiar",1080,"Pertencimento a Terra de Indígena (TI) versus Agricultura Familiar"
"pertencimento_a_unidade_de_conservacao_uc_versus_agricultura_familiar",1363,"Pertencimento a Unidade de Conservação (UC) versus Agricultura Familiar"
"pessoa_que_realizou_o_ultimo_parto",721,"Pessoa que realizou o último parto"
"pessoa_que_recebeu_o_cuidado",850,"Pessoa que recebeu o cuidado"
"pessoal_ocupado_grupos_e_classes_de_atividades",12296,"Pessoal ocupado, grupos e classes de atividades"
"pessoas_intoxicadas",12591,"Pessoas intoxicadas"
"plano_de_contingencia_e_ou_prevencao_para_a_seca",1347,"Plano de Contingência e/ou Prevenção para a seca"
"plantel_de_suinos",12650,"Plantel de suínos"
"pontos_de_estrangulamento_que_resultam_em_inundacoes",12135,"Pontos de estrangulamento que resultam em inundações"
"pontos_de_lancamento_do_efluente",12130,"Pontos de lançamento do efluente"
"posicao_na_ocupacao",2399,"Posição na ocupação"
"posicao_na_ocupacao_e_categoria_do_emprego_no_trabalho_principal",11913,"Posição na ocupação e categoria do emprego no trabalho principal"
"posicao_na_ocupacao_e_categoria_do_emprego_no_trabalho_principal_do_responsavel_pelo_domicilio",1830,"Posição na ocupação e categoria do emprego no trabalho principal do responsável pelo domicílio"
"posicao_na_ocupacao_no_trabalho_principal",12029,"Posição na ocupação no trabalho principal"
"posicao_na_ocupacao_no_trabalho_principal_na_semana_de_referencia",12071,"Posição na ocupação no trabalho principal na semana de referência"
"posicao_na_ocupacao_no_trabalho_secundario",12037,"Posição na ocupação no trabalho secundário"
"posicao_na_ocupacao_principal_da_pessoa_de_referencia_da_familia",12509,"Posição na ocupação principal da pessoa de referência da família"
"posicao_na_ocupacao_subgrupo_e_categoria_do_emprego",11806,"Posição na ocupação, subgrupo e categoria do emprego"
"posicao_na_ocupacao_subgrupo_e_categoria_do_emprego_e_contribuicao_para_instituto_de_previdencia_oficial_no_trabalho_principal",12383,"Posição na ocupação, subgrupo e categoria do emprego e contribuição para instituto de previdência oficial no trabalho principal"
"posicao_na_ocupacao_subgrupo_e_categoria_do_emprego_no_trabalho_principal",12391,"Posição na ocupação, subgrupo e categoria do emprego no trabalho principal"
"posse_de_bens",845,"Posse de bens"
"posse_de_plano_de_saude_medico",1100,"Posse de plano de saúde médico"
"posse_de_telefone_movel_celular_para_uso_pessoal",427,"Posse de telefone móvel celular para uso pessoal"
"posse_ou_acesso_a_bens_ou_servicos",1032,"Posse ou acesso a bens ou serviços"
"potencia_dos_tratores",12605,"Potência dos tratores"
"predisposicao_para_pratica_de_atividade_fisica_durante_a_semana_caso_tenha_oportunidade",747,"Predisposição para prática de atividade física durante a semana, caso tenha oportunidade"
"presenca_no_cadunico",1879,"Presença no CADÚnico"
"primeiro_atendimento_da_crianca_por_esse_medico",1485,"Primeiro atendimento da criança por esse médico"
"primeiro_e_ultimo_ano_de_vigencia_do_plano",1532,"Primeiro e último ano de vigência do plano"
"principais_aspectos_em_relacao_ao_pessoal_ocupado",12576,"Principais aspectos em relação ao pessoal ocupado"
"principal_fonte_de_abastecimento_de_agua",825,"Principal fonte de abastecimento de água"
"principal_forma_de_abastecimento_de_agua",301,"Principal forma de abastecimento de água"
"principal_grande_regiao_de_destino",909,"Principal Grande Região de destino"
"principal_local_de_hospedagem",907,"Principal local de hospedagem"
"principal_meio_de_transporte_utilizado",908,"Principal meio de transporte utilizado"
"principal_mes_da_colheita",12525,"Principal mês da colheita"
"principal_mes_do_plantio",12526,"Principal mês do plantio"
"principal_motivo_da_nota_atribuida_ao_servico_de_saude_pela_pessoa_responsavel_pelos_cuidados_de_saude_da_crianca",1472,"Principal motivo da nota atribuída ao serviço de saúde pela pessoa responsável pelos cuidados de saúde da criança"
"principal_motivo_da_procura_a_uma_unidade_basica_de_saude",763,"Principal motivo da procura a uma Unidade Básica de Saúde"
"principal_motivo_da_utima_consulta_medica",1476,"Principal motivo da útima consulta médica"
"principal_motivo_de_atualmente_nao_frequentar_escola_ou_outro_curso",879,"Principal motivo de atualmente não frequentar escola ou outro curso"
"principal_motivo_de_nao_evitar_a_gravidez",705,"Principal motivo de não evitar a gravidez"
"principal_motivo_de_nao_frequentar_creche_ou_escola",894,"Principal motivo de não frequentar creche ou escola"
"principal_motivo_de_nao_frequentarem_escola",12090,"Principal motivo de não frequentarem escola"
"principal_motivo_de_nao_ter_comparecido_a_creche_ou_escola",12664,"Principal motivo de não ter comparecido à creche ou escola"
"principal_motivo_de_nao_ter_feito_a_cirurgia_de_catarata",627,"Principal motivo de não ter feito a cirurgia de catarata"
"principal_motivo_de_nao_ter_tomado_a_vacina",1805,"Principal motivo de não ter tomado a vacina"
