"frequencia_da_analise_da_concentracao_de_fluor",11995,"Frequência da análise da concentração de fluor"
"frequencia_da_coleta_de_residuos_solidos",12186,"Frequência da coleta de resíduos sólidos"
"frequencia_das_reunioes_do_forum_da_agenda_21_local",483,"Frequência das reuniões do Fórum da Agenda 21 Local"
"frequencia_de_aulas_de_educacao_fisica_na_escola_nos_7_dias_anteriores_a_pesquisa",563,"Frequência de aulas de educação física na escola nos 7 dias anteriores à pesquisa"
"frequencia_de_consultas_medicas_nos_ultimos_12_meses_anteriores_a_pesquisa",1119,"Frequência de consultas médicas nos últimos 12 meses anteriores à pesquisa"
"frequencia_de_consumo_alimentar",565,"Frequência de consumo alimentar"
"frequencia_de_consumo_de_alimentos_em_restaurantes_fast_food_nos_7_dias_anteriores_a_pesquisa",765,"Frequência de consumo de alimentos em restaurantes fast-food, nos 7 dias anteriores à pesquisa"
"frequencia_de_consumo_de_alimentos_industrializados_ou_ultraprocessados_salgados_nos_7_dias_anteriores_a_pesquisa",772,"Frequência de consumo de alimentos industrializados ou ultraprocessados salgados, nos 7 dias anteriores à pesquisa"
"frequencia_de_consumo_de_feijao_nos_7_dias_anteriores_a_pesquisa",766,"Frequência de consumo de feijão, nos 7 dias anteriores à pesquisa"
"frequencia_de_consumo_de_frutas_frescas_nos_7_dias_anteriores_a_pesquisa",768,"Frequência de consumo de frutas frescas, nos 7 dias anteriores à pesquisa"
"frequencia_de_consumo_de_guloseimas_nos_7_dias_anteriores_a_pesquisa",770,"Frequência de consumo de guloseimas, nos 7 dias anteriores à pesquisa"
"frequencia_de_consumo_de_legumes_e_ou_verduras_nos_7_dias_anteriores_a_pesquisa",767,"Frequência de consumo de legumes e/ou verduras, nos 7 dias anteriores à pesquisa"
"frequencia_de_consumo_de_refrigerante_nos_7_dias_anteriores_a_pesquisa",771,"Frequência de consumo de refrigerante, nos 7 dias anteriores à pesquisa"
"frequencia_de_consumo_de_salgados_fritos_nos_7_dias_anteriores_a_pesquisa",769,"Frequência de consumo de salgados fritos, nos 7 dias anteriores à pesquisa"
"frequencia_de_dias_em_que_fez_atividade_fisica_por_60_minutos_ou_mais_nos_7_dias_anteriores_a_pesquisa",746,"Frequência de dias em que fez atividade física por 60 minutos ou mais nos 7 dias anteriores à pesquisa"
"frequencia_de_ida_ao_dentista",572,"Frequência de ida ao dentista"
"frequencia_de_uso_de_crack",568,"Frequência de uso de crack"
"frequencia_de_uso_de_drogas",566,"Frequencia de uso de drogas"
"frequencia_de_uso_de_maconha",567,"Frequência de uso de maconha"
"frequencia_de_utilizacao_da_internet",12297,"Frequência de utilização da internet"
"frequencia_de_violencia",1251,"Frequência de violência"
"frequencia_do_manuseio",1262,"Frequência do manuseio"
"frequencia_do_teletrabalho_no_domicilio",1681,"Frequência do teletrabalho no domicílio"
"frequencia_do_trabalho_no_domicilio",1678,"Frequência do trabalho no domicílio"
"frequencia_do_trabalho_voluntario",859,"Frequência do trabalho voluntário"
"frequencia_e_conclusao_do_curso_tecnico_de_nivel_medio_ou_normal_magisterio",878,"Frequência e conclusão do curso técnico de nível médio ou normal (magistério)"
"frequencia_que_trabalhava_por_24_horas_seguidas",1266,"Frequência que trabalhava por 24 horas seguidas"
"fumou_cigarro_alguma_vez_na_vida_mesmo_uma_ou_duas_tragadas",115,"Fumou cigarro alguma vez na vida, mesmo uma ou duas tragadas"
"funcao_da_entidade",11460,"Função da entidade"
"funcao_do_gestor_da_educacao_no_conselho_municipal_de_educacao",1516,"Função do gestor da educação no Conselho Municipal de Educação"
"funcionamento_de_servico_de_rede_movel_celular_para_telefonia_ou_internet_no_domicilio",955,"Funcionamento de serviço de rede móvel celular para telefonia ou Internet no domicílio"
"fundamento_da_separacao",1832,"Fundamento da separação"
"generos_da_industria_de_transformacao",8,"Gêneros da indústria de transformação"
"generos_de_comercio",320,"Gêneros de comércio"
"geracao_de_lodo_no_processo_de_tratamento",954,"Geração de lodo no processo de tratamento"
"geral_grupo_subgrupo_item_e_subitem",315,"Geral, grupo, subgrupo, item e subitem"
"geral_grupo_subgrupo_item_e_subitem_irsm",73,"Geral, grupo, subgrupo, item e subitem - IRSM"
"geral_grupos_subgrupos_itens_e_subitens",72,"Geral, grupos, subgrupos, itens e subitens"
"gestao_do_fundo_municipal_de_cultura",1538,"Gestão do Fundo Municipal de Cultura"
"grande_grupamento_e_secoes_da_classificacao_de_atividade_economica_cnae_2_0",956,"Grande grupamento e seções da classificação de atividade econômica (CNAE 2.0)"
"grande_regiao_e_unidade_da_federacao_de_destino",1378,"Grande Região e Unidade da Federação de destino"
"grande_regiao_e_unidade_da_federacao_de_origem",1374,"Grande Região e Unidade da Federação de origem"
"grandes_categorias_economicas",543,"Grandes categorias econômicas"
"grandes_grupos_de_ocupacao_no_trabalho_principal",12064,"Grandes grupos de ocupação no trabalho principal"
"grandes_grupos_subgrupos_principais_subgrupos_e_grupos_de_base_da_ocupacao_no_trabalho_principal",12397,"Grandes grupos, subgrupos principais, subgrupos e grupos de base da ocupação no trabalho principal"
"grandes_regioes",11068,"Grandes regiões"
"grandes_regioes_de_residencia_em_31_07_1995",11799,"Grandes Regiões de residência em 31/07/1995"
"grandes_regioes_e_unidades_da_federacao_das_pessoas_com_quem_residiram_antes_de_emigrarem",456,"Grandes Regiões e Unidades da Federação das pessoas com quem residiram antes de emigrarem"
"grandes_regioes_e_unidades_da_federacao_de_atuacao_das_empresas",12354,"Grandes regiões e unidades da federação de atuação das empresas"
"grau",291,"Grau"
"grau_de_dificuldade",623,"Grau de dificuldade"
"grau_de_dificuldade_para_ouvir",1281,"Grau de dificuldade para ouvir"
"grau_de_especializacao_do_estabelecimento",11,"Grau de especialização do estabelecimento"
"grau_de_importancia",701,"Grau de importância"
"grau_de_importancia_atribuido_a_propria_imagem_corporal",758,"Grau de importância atribuído à própria imagem corporal"
"grau_de_integracao_com_o_mercado",12,"Grau de integração com o mercado"
"grau_de_novidade_do_principal_produto_e_ou_principal_processo_nas_empresas_que_implementaram_inovacoes",711,"Grau de novidade do principal produto e/ou principal processo nas empresas que implementaram inovações"
"grau_do_curso_completo_mais_elevado",136,"Grau do curso completo mais elevado"
"grau_e_serie_que_frequentavam",135,"Grau e série que frequentavam"
"grau_que_frequentavam",12229,"Grau que frequentavam"
"grupamento_de_atividade_do_trabalho_principal",12072,"Grupamento de atividade do trabalho principal"
"grupamento_de_atividade_no_trabalho_principal",888,"Grupamento de atividade no trabalho principal"
"grupamento_ocupacional_no_trabalho_principal_pnadc",694,"Grupamento ocupacional no trabalho principal - PNADC"
"grupamentos_de_atividade_do_trabalho_principal",12166,"Grupamentos de atividade do trabalho principal"
"grupamentos_ocupacionais_no_trabalho_principal",12167,"Grupamentos ocupacionais no trabalho principal"
"grupo_de_atividade_economica",219,"Grupo de atividade econômica"
"grupo_de_idade",58,"Grupo de idade"
"grupo_de_idade_da_mae",950,"Grupo de idade da mãe"
"grupo_de_idade_da_mulher",246,"Grupo de idade da mulher"
"grupo_de_idade_do_homem",245,"Grupo de idade do homem"
"grupo_de_idade_do_primeiro_conjuge",666,"Grupo de idade do primeiro cônjuge"
"grupo_de_idade_do_segundo_conjuge",667,"Grupo de idade do segundo cônjuge"
"grupo_de_pessoas",1414,"Grupo de pessoas"
"grupo_de_produtos",11045,"Grupo de produtos"
"grupos_de_alimentos_e_alimentos",394,"Grupos de alimentos e alimentos"
"grupos_de_anos_de_direcao_dos_trabalhos_nos_estabelecimentos_agropecuarios",12775,"Grupos de anos de direção dos trabalhos nos estabelecimentos agropecuários"
"grupos_de_anos_de_estudo",71,"Grupos de anos de estudo"
"grupos_de_anos_de_estudo_da_pessoa_responsavel_pelo_domicilio",11567,"Grupos de anos de estudo da pessoa responsável pelo domicílio"
"grupos_de_anos_de_estudo_das_mulheres",12302,"Grupos de anos de estudo das mulheres"
"grupos_de_anos_em_que_fixaram_residencia_no_pais",304,"Grupos de anos em que fixaram residência no país"
"grupos_de_area_colhida",12523,"Grupos de área colhida"
"grupos_de_area_cortada",12518,"Grupos de área cortada"
"grupos_de_area_de_espellho_dagua",12737,"Grupos de área de espellho d'água"
"grupos_de_area_de_lavoura",12603,"Grupos de área de lavoura"
"grupos_de_area_de_pastagem",12625,"Grupos de área de pastagem"
"grupos_de_area_total",220,"Grupos de área total"
"grupos_de_atividade_economica",12517,"Grupos de atividade econômica"
"grupos_de_atividades",12223,"Grupos de atividades"
"grupos_de_cabecas_de_asininos",12723,"Grupos de cabeças de asininos"
"grupos_de_cabecas_de_bovinos",3244,"Grupos de cabeças de bovinos"
"grupos_de_cabecas_de_bubalinos",12726,"Grupos de cabeças de bubalinos"
"grupos_de_cabecas_de_caprinos",12728,"Grupos de cabeças de caprinos"
"grupos_de_cabecas_de_equinos",12722,"Grupos de cabeças de equinos"
"grupos_de_cabecas_de_galinhas_galos_frangos_frangas_e_pintos",12653,"Grupos de cabeças de galinhas, galos, frangos, frangas e pintos"
"grupos_de_cabecas_de_muares",12724,"Grupos de cabeças de muares"
"grupos_de_cabecas_de_ovinos",12732,"Grupos de cabeças de ovinos"
"grupos_de_cabecas_de_suinos",12649,"Grupos de cabeças de suínos"
"grupos_de_capacidade_util",11278,"Grupos de capacidade útil"
"grupos_de_despesa",12189,"Grupos de despesa"
"grupos_de_horas_habitualmente_trabalhadas_por_semana_em_todos_os_trabalhos",11803,"Grupos de horas habitualmente trabalhadas por semana em todos os trabalhos"
"grupos_de_horas_habitualmente_trabalhadas_por_semana_no_trabalho_principal",12045,"Grupos de horas habitualmente trabalhadas por semana no trabalho principal"
"grupos_de_horas_trabalhadas_por_semana_em_todos_os_trabalhos",12103,"Grupos de horas trabalhadas por semana em todos os trabalhos"
"grupos_de_idade_a_partir_dos_10_anos",70,"Grupos de idade a partir dos 10 anos"
"grupos_de_idade_com_que_comecaram_a_trabalhar",12034,"Grupos de idade com que começaram a trabalhar"
"grupos_de_idade_da_mae_na_ocasiao_do_parto",239,"Grupos de idade da mãe na ocasião do parto"
"grupos_de_idade_da_mulher_na_data_da_abertura_do_processo",736,"Grupos de idade da mulher na data da abertura do processo"
"grupos_de_idade_da_mulher_na_data_da_sentenca",275,"Grupos de idade da mulher na data da sentença"
"grupos_de_idade_da_pessoa_de_referencia_da_familia",12508,"Grupos de idade da pessoa de referência da família"
"grupos_de_idade_da_pessoa_falecida",259,"Grupos de idade da pessoa falecida"
"grupos_de_idade_da_pessoa_responsavel_pela_familia",12240,"Grupos de idade da pessoa responsável pela família"
"grupos_de_idade_da_pessoa_responsavel_pelo_domicilio",11562,"Grupos de idade da pessoa responsável pelo domicílio"
"grupos_de_idade_das_mulheres",12232,"Grupos de idade das mulheres"
"grupos_de_idade_das_pessoas_ao_falecerem",420,"Grupos de idade das pessoas ao falecerem"
"grupos_de_idade_do_chefe_da_familia",282,"Grupos de idade do chefe da família"
"grupos_de_idade_do_marido_na_data_da_abertura_do_processo",735,"Grupos de idade do marido na data da abertura do processo"
"grupos_de_idade_do_marido_na_data_da_sentenca",274,"Grupos de idade do marido na data da sentença"
"grupos_de_idade_do_prefeito",12450,"Grupos de idade do prefeito"
"grupos_de_idade_dos_conjuges_na_data_da_abertura_do_processo",267,"Grupos de idade dos cônjuges na data da abertura do processo"
"grupos_de_idade_dos_conjuges_na_data_da_sentenca",277,"Grupos de idade dos cônjuges na data da sentença"
"grupos_de_idade_e_nivel_de_ensino",582,"Grupos de idade e nível de ensino"
"grupos_de_ocupacao_antiga_classificacao_no_trabalho_principal",12394,"Grupos de ocupação (antiga classificação) no trabalho principal"
"grupos_de_ocupacao_do_trabalho_principal",12047,"Grupos de ocupação do trabalho principal"
"grupos_de_pessoal_ocupado",11574,"Grupos de pessoal ocupado"
"grupos_de_pessoas_da_familia",12577,"Grupos de pessoas da família"
"grupos_de_pessoas_no_empreendimento",12105,"Grupos de pessoas no empreendimento"
"grupos_de_produtos",215,"Grupos de produtos"
"grupos_de_renda_dos_estabelecimentos_agropecuarios",141,"Grupos de renda dos estabelecimentos agropecuários"
"grupos_de_renda_monetaria_dos_estabelecimentos_agropecuarios",285,"Grupos de renda monetária dos estabelecimentos agropecuários"
"grupos_de_unidades_habitacionais",494,"Grupos de unidades habitacionais"
"grupos_e_classes_de_atividade",12440,"Grupos e classes de atividade"
"grupos_e_classes_industriais",542,"Grupos e classes industriais"
"grupos_e_subgrupos_de_produtos",216,"Grupos e subgrupos de produtos"
"grupos_e_tipos_de_despesa",313,"Grupos e tipos de despesa"
"grupos_industriais_selecionados",844,"Grupos industriais selecionados"
"grupos_taxonomicos",12919,"Grupos taxonômicos"
"grupos_taxonomicos_habito_ou_forma_de_vida",454,"Grupos taxonômicos, hábito ou forma de vida"
"grupos_subgrupos_e_produtos",217,"Grupos, subgrupos e produtos"
"habitats",12921,"Habitats"
"habito_ou_forma_de_vida",12931,"Hábito ou forma de vida"
"idade",287,"Idade"
"idade_da_mae_na_ocasiao_do_parto",240,"Idade da mãe na ocasião do parto"
"idade_das_mulheres",252,"Idade das mulheres"
"idade_do_homem",251,"Idade do homem"
"idade_do_titular_do_orgao_gestor",1054,"Idade do titular do órgão gestor"
"idade_do_a_falecido_a",260,"Idade do(a) falecido(a)"
"idade_media_da_agencia_de_publicidade",440,"Idade média da agência de publicidade"
"idade_quando_experimentou_bebida_alcoolica_pela_1a_vez",128,"Idade quando experimentou bebida alcoólica pela 1ª vez"
"idade_quando_experimentou_cigarro_pela_1a_vez",117,"Idade quando experimentou cigarro pela 1ª vez"
"idade_quando_teve_relacao_sexual_pela_1a_vez",153,"Idade quando teve relação sexual pela 1ª vez"
"idade_que_deixou_de_frequentar_escola_pela_ultima_vez",897,"Idade que deixou de frequentar escola pela última vez"
"iluminacao_eletrica",2613,"Iluminação elétrica"
"impacto_das_inovacoes_de_produto_e_ou_processo",702,"Impacto das inovações de produto e/ou processo"
"impactos_ambientais_causados_pelas_inovacoes",880,"Impactos ambientais causados pelas inovações"
"implantacao_colocacao_do_diu_nos_servicos_de_saude_de_atencao_basica",1611,"Implantação/colocação do DIU nos serviços de saúde de Atenção Básica"
"implementacao_de_acoes_durante_a_pandemia_da_covid_19",1252,"Implementação de ações durante a pandemia da COVID-19"
"implementacao_de_acoes_para_assegurar_a_protecao_social_das_familias_e_individuos_em_situacao_de_risco_e_ou_vulnerabilidade_social",1253,"Implementação de ações para assegurar a proteção social das famílias e indivíduos em situação de risco e/ou vulnerabilidade social"
"inclusao_de_acoes_previstas_na_politica_nacional_de_saude_integral_da_populacao_negra_no_plano",1583,"Inclusão de ações previstas na Política Nacional de Saúde Integral da População Negra no plano"
"indicacao_do_servico_executado",12221,"Indicação do serviço executado"
"indicador_de_situacao_habitacional",12075,"Indicador de situação habitacional"
"indicadores_especiais",25,"Indicadores especiais"
"indicativo_de_deficiencia_fisica",12082,"Indicativo de deficiência física"
"indicativo_de_filhos",11801,"Indicativo de filhos"
"indicativo_de_microempreendedor_individual_mei_com_empregado",1724,"Indicativo de microempreendedor individual (MEI) com empregado"
"indicativo_de_microempreendedor_individual_mei_com_endereco_na_residencia",1726,"Indicativo de microempreendedor individual (MEI) com endereço na residência"
"indicativo_de_microempreendedor_individual_mei_com_vinculo_formal_previo_na_mesma_classe_cnae",1756,"Indicativo de microempreendedor individual (MEI) com vínculo formal prévio na mesma classe CNAE"
"indicativo_de_rendimento",12035,"Indicativo de rendimento"
"indicativo_de_residencia_na_sede_municipal",11333,"Indicativo de residência na sede municipal"
"indicativo_de_vinculo_previo_e_intersticio_ate_a_filiacao_do_microempreendedor_individual_mei",1728,"Indicativo de vínculo prévio e interstício até a filiação do microempreendedor individual (MEI)"
"indicativo_e_numero_de_filhos_nascidos_vivos",12055,"Indicativo e número de filhos nascidos vivos"
"indicativo_se_o_prefeito_exercia_mandato_no_ultimo_ano_da_legislatura_anterior",12448,"Indicativo se o prefeito exercia mandato no último ano da legislatura anterior"
"indicativo_causa_de_desligamento",1742,"Indicativo/causa de desligamento"
"industria_geral_industrias_extrativas_e_industrias_de_transformacao_e_atividades_cnae_2_0",842,"Indústria geral, indústrias extrativas e indústrias de transformação e atividades (CNAE 2.0)"
"industria_geral_industrias_extrativas_industrias_de_transformacao_e_atividades_cnae_2_0",715,"Indústria geral, indústrias extrativas, indústrias de transformação e atividades (CNAE 2.0)"
"industrias_de_transformacao_e_atividades_cnae_2_0",405,"Indústrias de transformação e atividades (CNAE 2.0)"
"infraestrutura_das_escolas",812,"Infraestrutura das escolas"
"inovacoes_organizacionais_e_de_marketing_implementadas",732,"Inovações organizacionais e de marketing implementadas"
"insercao_dos_topicos_especificos_nos_cursos_e_processos_de_formacao_do_pessoal_ocupado_na_area_da_saude",1584,"Inserção dos tópicos específicos nos cursos e processos de formação do pessoal ocupado na área da saúde"
"instalacao_de_tendas_de_triagem_para_o_combate_a_covid_19",1348,"Instalação de tendas de triagem para o combate a COVID-19"
"instalacao_sanitaria",1612,"Instalação sanitária"
"instituicao_de_forum_permanente_de_educacao",1493,"Instituição de Fórum Permanente de Educação"
"instituicao_de_realizacao_do_curso",884,"Instituição de realização do curso"
"instituicao_de_sistema_municipal_de_esporte",1563,"Instituição de Sistema Municipal de Esporte"
"instrumento_financeiro",12116,"Instrumento financeiro"
"instrumentos_de_planejamento",1674,"Instrumentos de Planejamento"
"insumos_tipicos_da_construcao_civil",76,"Insumos típicos da construção civil"
"item_de_gasto",1341,"Item de gasto"
"legalidade_da_marca_do_cigarro",1123,"Legalidade da marca do cigarro"
"levantamento_de_demanda_da_populacao_em_idade_escolar_que_nao_esteja_sendo_atendida",1523,"Levantamento de demanda da população em idade escolar que não esteja sendo atendida"
"locais_de_compra",213,"Locais de compra"
"local_da_escola_ou_creche_que_frequentavam",468,"Local da escola ou creche que frequentavam"
"local_da_escola_que_frequentavam",596,"Local da escola que frequentavam"
"local_da_falta_de_seguranca",571,"Local da falta de segurança"
"local_da_ultima_consulta_odontologica",1125,"Local da última consulta odontológica"
"local_da_unica_ocorrencia_ou_a_mais_grave",1261,"Local da única ocorrência ou a mais grave"
"local_de_acompanhamento_do_crescimento_e_desenvolvimento_das_criancas",724,"Local de acompanhamento do crescimento e desenvolvimento das crianças"
"local_de_atendimento_da_maioria_das_consultas_de_pre_natal",720,"Local de atendimento da maioria das consultas de pré-natal"
"local_de_atendimento_medico",1245,"Local de atendimento médico"
"local_de_consulta_medica_ou_de_enfermagem",723,"Local de consulta médica ou de enfermagem"
"local_de_estabelecimento_do_trabalho_principal",12041,"Local de estabelecimento do trabalho principal"
"local_de_exercicio_do_trabalho_principal",469,"Local de exercício do trabalho principal"
"local_de_ocorrencia",257,"Local de ocorrência"
"local_de_ocorrencia_do_furto",1354,"Local de ocorrência do furto"
"local_de_ocorrencia_do_roubo",1360,"Local de ocorrência do roubo"
"local_de_origem",12932,"Local de origem"
"local_de_procura_de_atendimento_de_saude",695,"Local de procura de atendimento de saúde"
"local_de_uso_da_energia_eletrica",12582,"Local de uso da energia elétrica"
"local_do_exercicio_do_trabalho",903,"Local do exercício do trabalho"
"local_do_foco_de_calor",12680,"Local do foco de calor"
"local_do_nascimento",237,"Local do nascimento"
"local_do_trabalho_voluntario",858,"Local do trabalho voluntário"
"local_do_ultimo_atendimento_medico",669,"Local do último atendimento médico"
"local_onde_foi_feita_a_adubacao",12588,"Local onde foi feita a adubação"
"local_onde_ocorreu_o_tratamento_de_esterco_dos_animais",12628,"Local onde ocorreu o tratamento de esterco dos animais"
"localizacao",60,"Localização"
"localizacao_da_fonte_de_informacao",725,"Localização da fonte de informação"
"localizacao_de_destino_do_lixo",12208,"Localização de destino do lixo"
"localizacao_do_dispositivo_coletivo_de_detencao_ou_amortecimento_de_vazao_de_aguas_pluviais_urbanas",340,"Localização do dispositivo coletivo de detenção ou amortecimento de vazão de águas pluviais urbanas"
"localizacao_do_domicilio",2661,"Localização do domicílio"
"localizacao_do_estabelecimento_de_hospedagem",795,"Localização do estabelecimento de hospedagem"
"localizacao_do_principal_parceiro",727,"Localização do principal parceiro"
"localizacao_do_s_macromedidor_es",1000,"Localização do(s) macromedidor(es)"
"lugar_de_nascimento",183,"Lugar de nascimento"
"lugar_de_nascimento_da_mae",242,"Lugar de nascimento da mãe"
"lugar_de_nascimento_da_mulher",254,"Lugar de nascimento da mulher"
"lugar_de_nascimento_do_homem",253,"Lugar de nascimento do homem"
"lugar_de_nascimento_do_pai",241,"Lugar de nascimento do pai"
"lugar_de_nascimento_do_primeiro_conjuge",678,"Lugar de nascimento do primeiro cônjuge"
"lugar_de_nascimento_do_segundo_conjuge",679,"Lugar de nascimento do segundo cônjuge"
"lugar_de_nascimento_e_residencia_da_mae",243,"Lugar de nascimento e residência da mãe"
"lugar_de_residencia_anterior",3014,"Lugar de residência anterior"
"lugar_de_residencia_da_mae",234,"Lugar de residência da mãe"
"lugar_de_residencia_do_a_falecido_a",258,"Lugar de residência do(a) falecido(a)"
"lugar_de_residencia_em_31_de_julho_de_1995",12108,"Lugar de residência em 31 de julho de 1995"
"lugar_de_residencia_em_31_07_1995",12102,"Lugar de residência em 31.07.1995"
"lugar_de_residencia_em_31_07_1995_1",12107,"Lugar de residência em 31/07/1995"
"lugar_de_residencia_em_31_07_2005",508,"Lugar de residência em 31/07/2005"
"lugar_do_municipio_de_residencia_anterior",312,"Lugar do município de residência anterior"
"lugar_do_municipio_de_residencia_em_01_09_1986",310,"Lugar do município de residência em 01.09.1986"
"manifestacao_de_sintomas_e_ocorrencia_de_internacao_na_primeira_vez_que_teve_a_doenca",1822,"Manifestação de sintomas e ocorrência de internação na primeira vez que teve a doença"
"manifestacao_de_sintomas_na_primeira_vez_que_teve_a_doenca",1808,"Manifestação de sintomas na primeira vez que teve a doença"
"manifestacao_de_sintomas_na_ultima_vez_que_teve_a_doenca",1812,"Manifestação de sintomas na última vez que teve a doença"
"manutencao_dos_reservatorios_em_operacao",932,"Manutenção dos reservatórios em operação"
"materiais_e_servicos",42,"Materiais e serviços"
"material_da_cobertura",127,"Material da cobertura"
"material_das_paredes",126,"Material das paredes"
"material_predominante_na_cobertura_telhado",817,"Material predominante na cobertura (telhado)"
"material_predominante_nas_paredes",338,"Material predominante nas paredes"
"material_predominante_no_piso",818,"Material predominante no piso"
"meio_de_informacao_sobre_crimes_na_cidade_em_que_reside",1393,"Meio de informação sobre crimes na cidade em que reside"
"meio_de_transporte_no_acidente_mais_grave",1263,"Meio de transporte no acidente mais grave"
"membro_da_familia_com_atividade_economica_fora_do_estabelecimento_agropecuario",12776,"Membro da família com atividade econômica fora do estabelecimento agropecuário"
"mes_de_ocorrencia",244,"Mês de ocorrência"
"mes_do_nascimento",235,"Mês do nascimento"
"mes_do_registro",236,"Mês do registro"
"mes_e_ano_de_ocorrencia_do_falecimento",322,"Mês e ano de ocorrência do falecimento"
"meses_de_contratacao",12580,"Meses de contratação"
"meses_do_ano",1020,"Meses do ano"
"metodo_contraceptivo_utilizado",706,"Método contraceptivo utilizado"
"metodo_de_curtimento",11532,"Método de curtimento"
"metodo_utilizado_para_irrigacao",12604,"Método utilizado para irrigação"
"modalidade",12918,"Modalidade"
"modalidade_de_oferta_do_curso",12504,"Modalidade de oferta do curso"
"modalidade_do_curso",12942,"Modalidade do curso"
"modo_como_o_escolar_conseguiu_bebida_alcoolica_nos_30_dias_anteriores_a_pesquisa",777,"Modo como o escolar conseguiu bebida alcoólica nos 30 dias anteriores à pesquisa"
"modo_como_o_escolar_conseguiu_cigarro_nos_30_dias_anteriores_a_pesquisa",776,"Modo como o escolar conseguiu cigarro nos 30 dias anteriores à pesquisa"
"mora_com_a_mae",31,"Mora com a mãe"
"mora_com_o_pai",32,"Mora com o pai"
"motivo_da_interrupcao_da_coleta_seletiva",12213,"Motivo da interrupção da coleta seletiva"
"motivo_da_nao_obtencao_do_financiamento",12541,"Motivo da não obtenção do financiamento"
"motivo_da_paralisacao",1007,"Motivo da paralisação"
"motivo_da_retirada_do_utero",704,"Motivo da retirada do útero"
"motivo_das_perdas_de_faturamento",990,"Motivo das perdas de faturamento"
"motivo_de_discriminacao",685,"Motivo de discriminação"
"motivo_de_nao_frequentar_a_escola_ou_creche",11177,"Motivo de não frequentar a escola ou creche"
"motivo_de_nao_haver_servico_de_televisao_por_assinatura",941,"Motivo de não haver serviço de televisão por assinatura"
"motivo_de_nao_haver_utilizacao_da_internet_no_domicilio",951,"Motivo de não haver utilização da Internet no domicílio"
