"existencia_de_intervencoes_implementadas_para_evitar_ou_minimizar_os_danos_causados_por_enxurradas_ou_inundacoes_bruscas",1229,"Existência de intervenções implementadas para evitar ou minimizar os danos causados por enxurradas ou inundações bruscas"
"existencia_de_intervencoes_para_evitar_ou_minimizar_os_danos_causados_por_enchentes_ou_inundacoes_graduais",1215,"Existência de intervenções para evitar ou minimizar os danos causados por enchentes ou inundações graduais"
"existencia_de_isencao_formal_da_tarifa_do_onibus_intramunicipal",1088,"Existência de isenção formal da tarifa do ônibus intramunicipal"
"existencia_de_legislacao",1672,"Existência de legislação"
"existencia_de_legislacao_municipal_de_protecao_ao_patrimonio_cultural_e_previsao_de_tombamento",1535,"Existência de legislação municipal de proteção ao patrimônio cultural e previsão de tombamento"
"existencia_de_legislacao_municipal_que_exige_a_aprovacao_de_sistema_de_abastecimento_de_agua_para_loteamentos_novos",12968,"Existência de legislação municipal que exige a aprovação de sistema de abastecimento de água para loteamentos novos"
"existencia_de_legislacao_municipal_que_exige_a_aprovacao_de_sistema_de_manejo_de_aguas_pluviais_para_loteamentos_novos",12972,"Existência de legislação municipal que exige a aprovação de sistema de manejo de águas pluviais para loteamentos novos"
"existencia_de_legislacao_municipal_que_exige_aprovacao_e_implantacao_de_sistema_de_esgotamento_sanitario_para_loteamentos_novos",12970,"Existência de legislação municipal que exige aprovação e implantação de sistema de esgotamento sanitário para loteamentos novos"
"existencia_de_legislacao_municipal_que_exige_aprovacao_e_implantacao_de_sistema_drenagem_pluvial_para_loteamentos_novos_e_ou_populares",12125,"Existência de legislação municipal que exige aprovação e implantação de sistema drenagem pluvial para loteamentos novos e/ou populares"
"existencia_de_legislacao_municipal_que_preve_mecanismo_de_controle_das_aguas_pluviais_efluentes_de_novos_loteamentos",12973,"Existência de legislação municipal que prevê mecanismo de controle das águas pluviais efluentes de novos loteamentos"
"existencia_de_legislacao_municipal_que_preve_mecanismo_de_preservacao_das_areas_de_recarga_de_aguas_subterranes",12974,"Existência de legislação municipal que prevê mecanismo de preservação das áreas de recarga de águas subterrânes"
"existencia_de_legislacao_municipal_sobre_protecao_de_mananciais",12967,"Existência de legislação municipal sobre proteção de mananciais"
"existencia_de_legislacao_ou_instrumento_de_gestao_ambiental_e_tipo_de_legislacao",1169,"Existência de legislação ou instrumento de gestão ambiental e tipo de legislação"
"existencia_de_lei_municipal_que_estabelece_a_criacao_de_conselhos_escolares",1518,"Existência de lei municipal que estabelece a criação de conselhos escolares"
"existencia_de_leitos_bercos_de_cuidados_intermediarios_em_estabelecimento_publico_ou_conveniado_com_o_sus",1625,"Existência de leitos/berços de cuidados intermediários em estabelecimento público ou conveniado com o SUS"
"existencia_de_leitos_bercos_de_unidade_de_terapia_intensiva_neonatal_em_estabelecimento_publico_ou_conveniado_com_o_sus",1624,"Existência de leitos/berços de unidade de terapia intensiva neonatal em estabelecimento público ou conveniado com o SUS"
"existencia_de_ligacao_a_rede_geral_de_distribuicao_de_agua_e_principal_forma_de_abastecimento_de_agua",1821,"Existência de ligação à rede geral de distribuição de água e principal forma de abastecimento de água"
"existencia_de_limpeza_periodica_dos_bueiros_da_cidade_especialmente_antes_do_periodo_de_chuvas",1237,"Existência de limpeza periódica dos bueiros da cidade, especialmente, antes do período de chuvas"
"existencia_de_local_publico_ou_privado_com_condicoes_de_realizar_testes_pcr_ou_sorologicos_em_pacientes_suspeitos_de_covid_19",1667,"Existência de local (público ou privado) com condições de realizar testes PCR ou sorológicos em pacientes suspeitos de COVID-19"
"existencia_de_mecanismos_de_consulta_publica_da_demanda_das_familias_por_creches",1524,"Existência de mecanismos de consulta pública da demanda das famílias por creches"
"existencia_de_medida_para_regulamentar_sancoes_multas_realizacao_compulsoria_de_exames_etc_em_caso_de_desrespeito_as_normas_de_isolamento_social",1249,"Existência de medida para regulamentar sanções (multas, realização compulsória de exames etc.) em caso de desrespeito as normas de isolamento social"
"existencia_de_medidas_adotadas_em_relacao_a_gestao_de_riscos_de_desastres_decorrentes_de_enchentes_ou_inundacoes_graduais_ou_enxurradas_ou_inundacoes_bruscas",1236,"Existência de medidas adotadas em relação à gestão de riscos de desastres decorrentes de enchentes ou inundações graduais, ou enxurradas ou inundações bruscas"
"existencia_de_medidas_adotadas_em_relacao_a_gestao_de_riscos_de_desastres_decorrentes_de_escorregamentos_ou_deslizamentos_de_encostas",1238,"Existência de medidas adotadas em relação à gestão de riscos de desastres decorrentes de escorregamentos ou deslizamentos de encostas"
"existencia_de_medidor_do_consumo_de_energia_eletrica",421,"Existência de medidor do consumo de energia elétrica"
"existencia_de_metas_no_plano_municipal_de_cultura",1534,"Existência de metas no Plano Municipal de Cultura"
"existencia_de_microcomputador_ou_tablet_no_domicilio",687,"Existência de microcomputador ou tablet no domicílio"
"existencia_de_microcomputador_acesso_a_internet_e_tipo_de_telefone",12228,"Existência de microcomputador, acesso à Internet e tipo de telefone"
"existencia_de_modelo_proprio_de_caderneta_ou_cartao_de_registro_de_vacina_fornecido_ao_usuario",1608,"Existência de modelo próprio de caderneta ou cartão de registro de vacina fornecido ao usuário"
"existencia_de_moradores_com_60_anos_ou_mais",1825,"Existência de moradores com 60 anos ou mais"
"existencia_de_moradores_menores_de_18_anos",1827,"Existência de moradores menores de 18 anos"
"existencia_de_moradores_menores_de_5_anos",1824,"Existência de moradores menores de 5 anos"
"existencia_de_orgao_publico_que_atue_na_assistencia_tecnica_e_ou_extensao_rural",1141,"Existência de órgão público que atue na assistência técnica e/ou extensão rural"
"existencia_de_pessoa_com_nivel_superior_na_familia",12512,"Existência de pessoa com nível superior na família"
"existencia_de_pessoas_desalojadas_ou_desabrigadas_no_ano_do_desastre_natural_de_maior_impacto_para_o_municipio",1212,"Existência de pessoas desalojadas ou desabrigadas no ano do desastre natural de maior impacto para o município"
"existencia_de_plano_de_carreira_para_o_magisterio",1494,"Existência de Plano de Carreira para o Magistério"
"existencia_de_plano_de_carreira_vigente_para_os_as_profissionais_da_educacao_nao_docentes",1498,"Existência de Plano de Carreira vigente para os(as) profissionais da educação não docentes"
"existencia_de_plano_de_gestao_integrada_de_residuos_solidos",1173,"Existência de Plano de Gestão Integrada de Resíduos Sólidos"
"existencia_de_plano_diretor",1480,"Existência de Plano Diretor"
"existencia_de_plano_municipal",1329,"Existência de Plano Municipal"
"existencia_de_plano_municipal_de_cultura",1529,"Existência de Plano Municipal de Cultura"
"existencia_de_politica_programa_ou_acoes_na_area_de_saude",1609,"Existência de política, programa ou ações na área de saúde"
"existencia_de_pontos_de_cultura",1548,"Existência de pontos de cultura"
"existencia_de_previsao_expressa_do_limite_de_2_3_dois_tercos_da_carga_horaria_para_o_desempenho_das_atividades_de_interacao_com_os_educandos_na_lei_do_plano",1496,"Existência de previsão expressa do limite de 2/3 (dois terços) da carga horária para o desempenho das atividades de interação com os educandos na lei do plano"
"existencia_de_problemas_no_domicilio",12197,"Existência de problemas no domicílio"
"existencia_de_programa_de_agentes_comunitarios_de_saude",1589,"Existência de Programa de Agentes Comunitários de Saúde"
"existencia_de_programa_de_planejamento_familiar_ou_reprodutivo",1610,"Existência de programa de Planejamento Familiar ou Reprodutivo"
"existencia_de_programa_de_saude_da_familia_com_ou_sem_atendimento_odontologico_basico_ou_de_estrutura_similar",1591,"Existência de Programa de Saúde da Família, com ou sem atendimento odontológico básico, ou de estrutura similar"
"existencia_de_programa_ou_acao_para_aquisicao_de_produtos_agropecuarios",1148,"Existência de programa ou ação para aquisição de produtos agropecuários"
"existencia_de_programa_ou_acao_para_disponibilizar_maquinario_aos_produtores_agropecuarios",1139,"Existência de programa ou ação para disponibilizar maquinário aos produtores agropecuários"
"existencia_de_programa_ou_acao_para_estimulo_as_atividade_agropecuarias",1334,"Existência de programa ou ação para estímulo às atividade agropecuárias"
"existencia_de_programa_ou_acao_para_vacinacao_de_rebanho",1150,"Existência de programa ou ação para vacinação de rebanho"
"existencia_de_programa_ou_acao_social_tipo_de_programa_e_area_de_atuacao",1144,"Existência de programa ou ação social, tipo de programa e área de atuação"
"existencia_de_programas_ambientais_implementados_em_parceria_com_o_governo_federal_e_tipo_de_programa",1174,"Existência de programas ambientais implementados em parceria com o Governo Federal e tipo de programa"
"existencia_de_programas_ou_acoes_na_area_de_saude_voltados_para_grupos_populacionais_especificos",1613,"Existência de programas ou ações na área de saúde voltados para grupos populacionais específicos"
"existencia_de_programas_ou_acoes_realizados_pela_prefeitura_nos_dois_anos_anteriores_ao_de_referencia_da_pesquisa",1075,"Existência de programas ou ações realizados pela prefeitura, nos dois anos anteriores ao de referência da pesquisa"
"existencia_de_projetos_no_orgao_gestor_da_educacao",1490,"Existência de projetos no órgão gestor da educação"
"existencia_de_promocao_ou_apoio_a_atividades_agropecuarias_e_desenvolvimento_de_programa_ou_acao_de_prevencao_contra_problemas_climaticos",1140,"Existência de promoção ou apoio a atividades agropecuárias e desenvolvimento de programa ou ação de prevenção contra problemas climáticos"
"existencia_de_racionamento_nos_ultimos_3_anos",1014,"Existência de racionamento nos últimos 3 anos"
"existencia_de_radio_no_domicilio",1710,"Existência de rádio no domicílio"
"existencia_de_recebimento_de_lixo_de_outro_municipio",12209,"Existência de recebimento de lixo de outro município"
"existencia_de_recursos_financeiros_proprios_para_a_area_de_meio_ambiente",1166,"Existência de recursos financeiros próprios para a área de meio ambiente"
"existencia_de_registro_das_vacinas_aplicadas_na_caderneta_de_saude_da_crianca_distribuida_pelo_ministerio_da_saude",1595,"Existência de registro das vacinas aplicadas na Caderneta de Saúde da Criança distribuída pelo Ministério da Saúde"
"existencia_de_rendimento",513,"Existência de rendimento"
"existencia_de_residencias_nas_unidades_de_destinacao_final_de_lixo",12212,"Existência de residências nas unidades de destinação final de lixo"
"existencia_de_reunioes_do_conselho_nos_ultimos_12_meses",1277,"Existência de reuniões do conselho nos últimos 12 meses"
"existencia_de_servico_de_atendimento_ao_publico",11998,"Existência de serviço de atendimento ao público"
"existencia_de_servico_de_inspecao_municipal_sim_para_controlar_a_qualidade_dos_produtos_de_origem_animal",1151,"Existência de Serviço de Inspeção Municipal (SIM) para controlar a qualidade dos produtos de origem animal"
"existencia_de_servico_de_nefrologia_em_estabelecimento_publico_ou_conveniado_com_o_sus",1623,"Existência de serviço de nefrologia em estabelecimento público ou conveniado com o SUS"
"existencia_de_servicos_e_bens_duraveis",11855,"Existência de serviços e bens duráveis"
"existencia_de_servicos_regulares_de_transporte_nos_municipios_e_tipo_de_transporte",1086,"Existência de serviços regulares de transporte nos municípios e tipo de transporte"
"existencia_de_tablet_no_domicilio",686,"Existência de tablet no domicílio"
"existencia_de_telefone",12062,"Existência de telefone"
"existencia_de_telefone_fixo_convencional",948,"Existência de telefone fixo convencional"
"existencia_de_telefone_movel_celular",949,"Existência de telefone móvel celular"
"existencia_de_televisao_com_conversor_para_receber_sinal_digital_de_televisao_aberta",939,"Existência de televisão com conversor para receber sinal digital de televisão aberta"
"existencia_de_televisao_e_tipo_de_televisao",974,"Existência de televisão e tipo de televisão"
"existencia_de_televisao_no_domicilio",937,"Existência de televisão no domicílio"
"existencia_de_transporte_coletivo_por_onibus_intermunicipal_e_caracteristicas_do_servico",1091,"Existência de transporte coletivo por ônibus intermunicipal e características do serviço"
"existencia_de_transporte_coletivo_por_onibus_intramunicipal",1087,"Existência de transporte coletivo por ônibus intramunicipal"
"existencia_de_utilizacao_da_internet_no_domicilio",688,"Existência de utilização da Internet no domicílio"
"existencia_de_violencia_ou_crime_ocorrido_nos_arredores_do_domicilio",1392,"Existência de violência ou crime ocorrido nos arredores do domicílio"
"existencia_e_avaliacao_dos_servicos_nos_arredores_do_domicilio",1388,"Existência e avaliação dos serviços nos arredores do domicílio"
"existencia_e_cobranca_do_servico_de_coleta",12012,"Existência e cobrança do serviço de coleta"
"existencia_e_etapas_do_tratamento_do_lodo",966,"Existência e etapas do tratamento do lodo"
"existencia_e_forma_de_cobranca_do_servico_de_esgotamento_sanitario",11456,"Existência e forma de cobrança do serviço de esgotamento sanitário"
"existencia_e_forma_de_cobranca_dos_servicos_especiais_ou_eventuais",12975,"Existência e forma de cobrança dos serviços especiais ou eventuais"
"existencia_e_forma_de_cobranca_pelo_servico",12983,"Existência e forma de cobrança pelo serviço"
"existencia_e_forma_de_protecao_na_captacao",11972,"Existência e forma de proteção na captação"
"existencia_e_localizacao_de_macromedidores",11988,"Existência e localização de macromedidores"
"existencia_e_localizacao_de_pontos_de_controle_ou_monitoramento_da_fluoretacao",11994,"Existência e localização de pontos de controle ou monitoramento da fluoretação"
"existencia_e_mes_de_racionamento_sazonal",973,"Existência e mês de racionamento sazonal"
"existencia_e_motivo_do_racionamento",11979,"Existência e motivo do racionamento"
"existencia_e_numero_de_banheiros_de_uso_exclusivo_do_domicilio",300,"Existência e número de banheiros de uso exclusivo do domicílio"
"existencia_e_numero_de_cooperativas_ou_associacoes_de_catadores",12978,"Existência e número de cooperativas ou associações de catadores"
"existencia_e_numero_de_interceptores",12010,"Existência e número de interceptores"
"existencia_e_programas_ou_acoes_de_controle_de_perdas_de_faturamento_da_agua_distribuida",991,"Existência e programas ou ações de controle de perdas de faturamento da água distribuída"
"existencia_e_tempo_de_interrupcao_da_fluoretacao",11993,"Existência e tempo de interrupção da fluoretação"
"existencia_e_tipo_de_analise_realizada_na_agua",11975,"Existência e tipo de análise realizada na água"
"existencia_e_tipo_de_cobranca",930,"Existência e tipo de cobrança"
"existencia_e_tipo_de_diferentes_criterios_para_determinacao_da_tarifa",979,"Existência e tipo de diferentes critérios para determinação da tarifa"
"existencia_e_tipo_de_instrumento_de_delegacao_do_servico",1009,"Existência e tipo de instrumento de delegação do serviço"
"existencia_e_tipo_de_meio_de_comunicacao",969,"Existência e tipo de meio de comunicação"
"existencia_e_tipo_de_orgao_regulador_do_servico",1013,"Existência e tipo de órgão regulador do serviço"
"existencia_e_tipo_de_poluicao_ou_contaminacao_na_captacao",12001,"Existência e tipo de poluição ou contaminação na captação"
"existencia_e_tipo_de_processamento_dos_residuos_solidos_de_servicos_de_saude_septicos",12201,"Existência e tipo de processamento dos resíduos sólidos de serviços de saúde sépticos"
"existencia_e_tipo_de_projeto_de_educacao_ambiental",972,"Existência e tipo de projeto de educação ambiental"
"existencia_e_tipo_de_registro_de_nascimento",297,"Existência e tipo de registro de nascimento"
"existencia_e_tipo_de_servico_de_atendimento_ao_publico",12015,"Existência e tipo de serviço de atendimento ao público"
"existencia_e_tipo_de_solucao_alternativa",968,"Existência e tipo de solução alternativa"
"existencia_e_tipo_de_tratamento_complementar",12008,"Existência e tipo de tratamento complementar"
"existencia_e_tipo_de_tratamento_complementar_por_desinfeccao",961,"Existência e tipo de tratamento complementar por desinfecção"
"existencia_e_tipo_de_tratamento_da_agua",11974,"Existência e tipo de tratamento da água"
"existencia_e_tipo_de_tratamento_do_lodo",12009,"Existência e tipo de tratamento do lodo"
"existencia_e_tipo_de_uso_a_jusante_do_corpo_receptor_do_esgoto",350,"Existência e tipo de uso a jusante do corpo receptor do esgoto"
"existencia_no_domicilio_de_morador_vitima_de_furto_ou_roubo",1385,"Existência no domicílio de morador vítima de furto ou roubo"
"existencia_ou_nao_de_pelo_menos_uma_das_deficiencias_investigadas",491,"Existência ou não de pelo menos uma das deficiências investigadas"
"expectativa_do_escolar_quanto_ao_nivel_de_escolaridade_que_alcancara",740,"Expectativa do escolar quanto ao nível de escolaridade que alcançará"
"expectativa_pretensao_do_escolar_apos_a_conclusao_do_curso_ciclo_de_estudos_em_que_se_encontra",741,"Expectativa/pretensão do escolar após a conclusão do curso/ciclo de estudos em que se encontra"
"experimentou_bebida_alcoolica_alguma_vez_na_vida",124,"Experimentou bebida alcoólica alguma vez na vida"
"exposicao_a_algum_fator_que_poderia_afetar_a_sua_saude",1267,"Exposição a algum fator que poderia afetar a sua saúde"
"faixa_de_pessoal_ocupado_no_programa_de_saude_da_familia_ou_similar",1593,"Faixa de pessoal ocupado no Programa de Saúde da Família ou similar"
"faixa_de_volume_de_consumo_de_agua",11984,"Faixa de volume de consumo de água"
"faixa_etaria_ideal_por_curso_frequentado",871,"Faixa etária ideal por curso frequentado"
"faixas_de_anos_de_experiencia_previa_no_mercado_formal_de_trabalho",1738,"Faixas de anos de experiência prévia no mercado formal de trabalho"
"faixas_de_idade",223,"Faixas de idade"
"faixas_de_pessoal_ocupado",319,"Faixas de pessoal ocupado"
"faixas_de_pessoal_ocupado_assalariado",370,"Faixas de pessoal ocupado assalariado"
"faixas_de_receita_total_em_r_1_000_00",11067,"Faixas de receita total (em R$ 1.000,00)"
"faixas_de_valor_de_receita",363,"Faixas de valor de receita"
"fatores_agravantes",12136,"Fatores agravantes"
"fatores_agravantes_da_erosao",12137,"Fatores agravantes da erosão"
"fatores_que_contribuiram_para_introducao_de_inovacoes_ambientais",911,"Fatores que contribuíram para introdução de inovações ambientais"
"fatores_que_prejudicaram_as_atividades_inovativas",731,"Fatores que prejudicaram as atividades inovativas"
"faz_transferencia_de_embrioes",342,"Faz transferência de embriões"
"finalidade_da_criacao",7940,"Finalidade da criação"
"finalidade_da_producao",1835,"Finalidade da produção"
"finalidade_da_viagem",892,"Finalidade da viagem"
"finalidade_do_acesso_a_internet",424,"Finalidade do acesso à internet"
"finalidade_do_financiamento",12543,"Finalidade do financiamento"
"finalidade_do_rebanho_bovino",225,"Finalidade do rebanho bovino"
"finalidade_do_servico_contratado",12571,"Finalidade do serviço contratado"
"finalidade_principal_da_producao_agropecuaria_do_estabelecimento",834,"Finalidade principal da produção agropecuária do estabelecimento"
"fonte_de_agua_utilizada",12602,"Fonte de água utilizada"
"fonte_de_emissao_de_gases_de_efeito_estufa",1340,"Fonte de emissão de gases de efeito estufa"
"fonte_de_energia_eletrica",827,"Fonte de energia elétrica"
"fonte_de_pagamento_do_plano_de_saude",1056,"Fonte de pagamento do plano de saúde"
"fonte_dos_recursos_nos_ultimos_12_meses",1178,"Fonte dos recursos nos últimos 12 meses"
"fontes_de_energia",12683,"Fontes de energia"
"fontes_de_informacao_empregadas",714,"Fontes de informação empregadas"
"forma_de_abastecimento_de_agua",61,"Forma de abastecimento de água"
"forma_de_abastecimento_de_agua_e_tipo_de_canalizacao",12104,"Forma de abastecimento de água e tipo de canalização"
"forma_de_acesso",1333,"Forma de acesso"
"forma_de_aquisicao",1876,"Forma de aquisição"
"forma_de_atuacao_da_entidade",11478,"Forma de atuação da entidade"
"forma_de_calculo_da_tarifa",978,"Forma de cálculo da tarifa"
"forma_de_cobranca_do_servico_de_limpeza_urbana_e_coleta_de_lixo",11464,"Forma de cobrança do serviço de limpeza urbana e coleta de lixo"
"forma_de_declaracao_da_idade",286,"Forma de declaração da idade"
"forma_de_disposicao_no_solo",354,"Forma de disposição no solo"
"forma_de_disposicao_no_solo_do_municipio",12200,"Forma de disposição no solo do município"
"forma_de_execucao_de_varricao_e_ou_capina",12188,"Forma de execução de varrição e/ou capina"
"forma_de_execucao_do_servico",12965,"Forma de execução do serviço"
"forma_de_execucao_dos_servicos",12171,"Forma de execução dos serviços"
"forma_de_financiamento_dos_subsidios",935,"Forma de financiamento dos subsídios"
"forma_de_insercao_na_atividade_voluntaria",857,"Forma de inserção na atividade voluntária"
"forma_de_mao_de_obra",6,"Forma de mão-de-obra"
"forma_de_medicao_ou_estimacao",999,"Forma de medição ou estimação"
"forma_de_obtencao_das_terras",12774,"Forma de obtenção das terras"
"forma_de_obtencao_de_informacoes_tecnicas_recebidas_pelo_estabelecimento",837,"Forma de obtenção de informações técnicas recebidas pelo estabelecimento"
"forma_de_obtencao_do_produto_ou_servico",12507,"Forma de obtenção do produto ou serviço"
"forma_de_participacao_de_catadores",12979,"Forma de participação de catadores"
"formas_de_comercializacao",12352,"Formas de comercialização"
"formas_de_nomeacao_dos_as_diretores_as_das_escolas_da_rede_municipal_de_ensino",1521,"Formas de nomeação dos(as) Diretores(as) das escolas da rede municipal de ensino"
"fornecimento_da_caderneta_de_saude_da_crianca_para_ser_distribuida_nos_estabelecimentos_privados_de_saude_fora_da_rede_do_sus_que_realizam_parto_e_ou_imunizacao",1596,"Fornecimento da Caderneta de Saúde da Criança para ser distribuída nos estabelecimentos privados de saúde (fora da rede do SUS) que realizam parto e/ou imunização"
"frequencia_a_atividades_coletivas_de_sua_ou_de_outra_religiao_nos_ultimos_12_meses",1272,"Frequência a atividades coletivas de sua ou de outra religião, nos últimos 12 meses"
"frequencia_a_creche_ou_escola",12081,"Frequência à creche ou escola"
"frequencia_a_creche_ou_escola_nivel_de_ensino_e_serie_que_frequentavam",12403,"Frequência à creche ou escola, nível de ensino e série que frequentavam"
"frequencia_a_curso_de_educacao_profissional",881,"Frequência a curso de educação profissional"
"frequencia_a_curso_de_qualificacao_profissional",882,"Frequência a curso de qualificação profissional"
"frequencia_a_curso_tecnico_de_nivel_medio",877,"Frequência a curso técnico de nível médio"
"frequencia_a_curso_tecnico_de_nivel_medio_ou_normal_magisterio",895,"Frequência a curso técnico de nível médio ou normal (magistério)"
"frequencia_a_escola",204,"Frequência à escola"
"frequencia_a_escola_e_local_da_escola",538,"Frequência à escola e local da escola"
"frequencia_a_escola_e_rede_de_ensino_que_frequentavam",12094,"Frequência à escola e rede de ensino que frequentavam"
"frequencia_a_escola_ou_creche_e_curso_e_serie_que_frequentavam",520,"Frequência à escola ou creche e curso e série que frequentavam"
"frequencia_a_escola_ou_creche_e_rede_de_ensino_que_frequentavam",465,"Frequência à escola ou creche e rede de ensino que frequentavam"
"frequencia_a_escola_grau_e_serie",290,"Frequência à escola, grau e série"
"frequencia_a_escola_rede_de_ensino_que_frequentavam_e_tempo_de_permanencia_diario_na_escola",12083,"Frequência à escola, rede de ensino que frequentavam e tempo de permanência diário na escola"
"frequencia_a_reunioes_com_outras_pessoas_para_pratica_de_atividades_esportivas_exercicios_fisicos_recreativos_ou_artisticos_nos_ultimos_12_meses",1271,"Frequência a reuniões com outras pessoas para prática de atividades esportivas, exercícios físicos, recreativos ou artísticos, nos últimos 12 meses"
"frequencia_a_reunioes_de_grupo_nos_ultimos_12_meses",1269,"Frequência a reuniões de grupo nos últimos 12 meses"
"frequencia_com_que_os_colegas_da_escola_os_trataram_bem_e_ou_foram_prestativos_com_eles",569,"Frequência com que os colegas da escola os trataram bem e/ou foram prestativos com eles"
"frequencia_com_que_receberam_a_visita_de_agente_comunitario_em_saude_acs_ou_membro_da_equipe_de_saude_da_familia_esf",1049,"Frequência com que receberam a visita de Agente Comunitário em Saúde (ACS) ou membro da Equipe de Saúde da Família (ESF)"
"frequencia_com_que_receberam_a_visita_de_agente_de_endemia",1078,"Frequência com que receberam a visita de agente de endemia"
"frequencia_com_que_se_sentiram_humilhados_pelas_provocacoes_de_colegas_de_escola",570,"Frequência com que se sentiram humilhados pelas provocações de colegas de escola"
"frequencia_com_que_usou_camisinha",1197,"Frequência com que usou camisinha"
